{
  "schema": "arc1.hardware/0.3",
  "revision": "R10-development",
  "board_family": "ARC-1",
  "simulation_only": false,
  "fabrication_status": "HOLD",
  "$comment": "Design-level facts from the owner-supplied R10 handoff (hardware/sources/r10). Nothing here is measured. Null means unknown, not zero. Supersedes the ER-002 R10 concept transcription of ARC1-PASS-0001.",
  "sources": [
    {
      "id": "r10_architecture",
      "path": "hardware/sources/r10/CURRENT_ARCHITECTURE.json",
      "sha256": "8f1990c4ce5abbeb6d125865b74a5eb19f6ebcde96bdb29a3677160dc084f3b6",
      "kind": "architecture_summary",
      "description": "R10 current-architecture summary (devices, links, storage, status)"
    },
    {
      "id": "r10_base",
      "path": "hardware/sources/r10/R10_WORK/BASE.md",
      "sha256": "a5b9411b2731239942cc0ba80e86ac96a1658652cec82b9630faa4fbb7a71675",
      "kind": "owner_spec",
      "description": "R10 authority and provenance; open owner confirmations"
    },
    {
      "id": "r10_decisions",
      "path": "hardware/sources/r10/R10_WORK/DECISIONS.md",
      "sha256": "c5fc1f30065fd83b9ef9378a66d23d7769694b2dd37a3a07d8d7b0cd955ae4ec",
      "kind": "decision_log",
      "description": "R10 decisions D1-D12 with reasons and reversal costs"
    },
    {
      "id": "r10_spec",
      "path": "hardware/sources/r10/R10_WORK/spec/ARC1_R10.txt",
      "sha256": "68d06ca2281045f168e40b2cd1401646a84e4e14a3ee8842f15daea5728ae159",
      "kind": "owner_spec",
      "description": "ARC-1 Architecture Change Control R10 rev 0.1 (text extraction)"
    },
    {
      "id": "r10_memory_spec",
      "path": "hardware/sources/r10/R10_WORK/spec/ARC1_MEMORY_R10.txt",
      "sha256": "a8ca79be3e982bc2bb123be0b41a13979d0b64f7ba722c3d5c7c695ae41c3074",
      "kind": "owner_spec",
      "description": "ARC1_MEMORY_R10 v0.1 memory architecture (text extraction)"
    },
    {
      "id": "r10_change_order",
      "path": "hardware/sources/r10/R10_WORK/hardware/R10_CHANGE_ORDER_1_1.md",
      "sha256": "3fba7d3318cd0dfa462a909a5e9dae5afaa1c8d43114fa711345f6c1df22f8e6",
      "kind": "decision_log",
      "description": "Change order rev 1.1 implementation: connectors, HDMI, USB, power"
    },
    {
      "id": "r10_interfaces",
      "path": "hardware/sources/r10/R10_WORK/architecture/R10_interface_matrix.csv",
      "sha256": "8c2ea8b731a92ae004eccfb90c2d848945d504bf37bfdd330805dcae0b75aef3",
      "kind": "interface_table",
      "description": "Generated R10 inter-chip pin table (65 rows)"
    },
    {
      "id": "r10_nor_map",
      "path": "hardware/sources/r10/R10_WORK/memory/R10_nor_partition.csv",
      "sha256": "9cceb30061f021d1d1578c6f35c15305dc2ad3254eb644d9284e28b99ed3cb3c",
      "kind": "design_source",
      "description": "Generated 64 MiB central NOR partition map"
    },
    {
      "id": "r10_gates",
      "path": "hardware/sources/r10/R10_WORK/qa/R10_gate_report.md",
      "sha256": "63850c14bb2ce4d0317e14b43f49a535ff8d88317588887397aebce3e8a7f01d",
      "kind": "qa_report",
      "description": "R10 gate report R10-A..H with evidence labels"
    },
    {
      "id": "r10_memory_gates",
      "path": "hardware/sources/r10/R10_WORK/qa/R10_memory_go_no_go.md",
      "sha256": "b0ef06aa615c78f0d8e75a7771fd58044640013d76832e342c4f68df695fd337",
      "kind": "qa_report",
      "description": "R10 memory go/no-go report"
    },
    {
      "id": "r10_continuation",
      "path": "hardware/sources/r10/R10_WORK/qa/R10_CONTINUATION.md",
      "sha256": "e2d0417ef2e22dc151057db23034b51a26a7141c5f98632fd9007f394ba16f04",
      "kind": "qa_report",
      "description": "Latest continuation: FPGA PG finding, ADV7513 guide evidence"
    },
    {
      "id": "r10_design",
      "path": "hardware/sources/r10/R10_WORK/cad/gen/design.py",
      "sha256": "f22ee8e472ed8979c33e23f509fdfa9ff96c9542d67e875a61d8fd1b80c92ab4",
      "kind": "design_source",
      "description": "Schematic generator: sheets, rails, clocks, nets"
    },
    {
      "id": "r10_parts",
      "path": "hardware/sources/r10/R10_WORK/cad/gen/parts.py",
      "sha256": "e68e3920fbcfa6d8c7292055ec57e12e5d4262ef67851ffd0809c47fea310bda",
      "kind": "design_source",
      "description": "Part library generator: MPNs, packages, pin sources"
    },
    {
      "id": "r10_vendor_index",
      "path": "hardware/sources/r10/R10_WORK/architecture/sources/sources.json",
      "sha256": "4c88e0497fc346280990e1567a8aa53322758daf5ab34834fc8ae5697218531b",
      "kind": "vendor_index",
      "description": "Index of 54 vendor documents with URL, revision and SHA-256"
    }
  ],
  "chips": [
    {
      "id": "f133",
      "part": "F133-B",
      "manufacturer": "Allwinner",
      "role": "system CPU, game-state authority, boot owner of the central NOR",
      "datasheet_ref": "r10_vendor_index#lcsc_f133b_ds2",
      "power_domain": "VDD_CORE 0.946 V (buck F133_CORE) + 1V8_DRAM (buck F133_DRAM) + system 3V3; reset supervisor TPS3808G09",
      "clock_sources": [
        "24 MHz crystal XTAL24 (r10_design#f133)"
      ],
      "boot_dependencies": [],
      "wiring_source": "r10_design#f133",
      "memory": [
        {
          "id": "f133_ddr2",
          "type": "in_package_ddr2",
          "capacity_bytes": 67108864,
          "owner": "f133",
          "controller": null,
          "access": null,
          "shared_address_space": false,
          "visibility": "Private to the owning chip; other chips reach it only through an explicit transfer over a declared link.",
          "provenance": "DESIGN",
          "source": "r10_architecture#devices"
        }
      ],
      "provenance": "DESIGN",
      "status": "Schematic captured; F133 bootloader core HOST_TESTED with mocks; no silicon boot (fabrication HOLD)"
    },
    {
      "id": "d213",
      "part": "D213ECV",
      "manufacturer": "ArtInChip",
      "role": "graphics computer: display/2D engine, scene setup, 45F scheduling",
      "datasheet_ref": "r10_vendor_index#aic_D21x_Datasheet_EN",
      "power_domain": "1V2_D213 core (buck D213_CORE) + 1V5_D213 DDR3 (buck D213_DRAM) + system 3V3",
      "clock_sources": [
        "24 MHz +-20 ppm crystal (r10_design#d213)"
      ],
      "boot_dependencies": [
        "f133"
      ],
      "wiring_source": "r10_design#d213",
      "memory": [
        {
          "id": "d213_ddr3",
          "type": "in_package_ddr3",
          "capacity_bytes": 134217728,
          "owner": "d213",
          "controller": null,
          "access": null,
          "shared_address_space": false,
          "visibility": "Private to the owning chip; other chips reach it only through an explicit transfer over a declared link.",
          "provenance": "DESIGN",
          "source": "r10_architecture#devices"
        }
      ],
      "provenance": "DESIGN",
      "status": "Supplier/lot open (R10 Q1, no distributor listing); bare-metal video R10-D NOT_RUN; GMAC driver NOT_RUN"
    },
    {
      "id": "gpu45",
      "part": "LFE5U-45F-6BG381C",
      "manufacturer": "Lattice Semiconductor",
      "role": "optional tile rasterizer (GPU), configured by the D213",
      "datasheet_ref": "r10_vendor_index#lattice_ecp5_datasheet",
      "power_domain": "VCC 1.095 V (TLV62569P buck with PG) + switched VCCIO 3V3_F45 + VCCAUX LDO (r10_design#power)",
      "clock_sources": [
        "25 MHz oscillator, OE = FPGA45_VCC_PG (r10_design#fpga45)",
        "RGMII RX clock from D213 GMAC0"
      ],
      "boot_dependencies": [
        "d213"
      ],
      "wiring_source": "r10_design#fpga45",
      "memory": [
        {
          "id": "gpu45_sdram",
          "type": "sdr_sdram_x16 (Alliance AS4C16M16SA-6TIN)",
          "capacity_bytes": 33554432,
          "owner": "gpu45",
          "controller": null,
          "access": null,
          "shared_address_space": false,
          "visibility": "Private to the owning chip; other chips reach it only through an explicit transfer over a declared link.",
          "provenance": "DESIGN",
          "source": "r10_parts#AS4C16M16SA"
        }
      ],
      "provenance": "DESIGN",
      "status": "Raster + RGMII endpoint RTL_SIMULATED; pin-locked OPEN_TOOLCHAIN_ROUTED 5/5 seeds; no board (R10-C)"
    },
    {
      "id": "fpga12",
      "part": "LFE5U-12F-6TG144C",
      "manufacturer": "Lattice Semiconductor",
      "role": "optional adaptive coprocessor; never owns game state",
      "datasheet_ref": "r10_vendor_index#lattice_ecp5_datasheet",
      "power_domain": "VCC 1.095 V (TLV62569P buck with PG) + switched VCCIO 3V3_F12 + VCCAUX LDO (r10_design#power)",
      "clock_sources": [
        "25 MHz oscillator, OE = FPGA12_VCC_PG (r10_design#fpga12)",
        "RGMII RX clock from F133"
      ],
      "boot_dependencies": [
        "f133"
      ],
      "wiring_source": "r10_design#fpga12",
      "memory": [
        {
          "id": "fpga12_psram",
          "type": "qspi_psram (AP Memory APS3204L-3SQNA-SN)",
          "capacity_bytes": 4194304,
          "owner": "fpga12",
          "controller": null,
          "access": null,
          "shared_address_space": false,
          "visibility": "Private to the owning chip; other chips reach it only through an explicit transfer over a declared link.",
          "provenance": "DESIGN",
          "source": "r10_memory_spec#S5"
        }
      ],
      "provenance": "DESIGN",
      "status": "RGMII + engine RTL_SIMULATED; proxy-package OPEN_TOOLCHAIN_ROUTED 10/10; TQFP144 pin-locked P&R NOT_RUN (D4)"
    }
  ],
  "peripherals": [
    {
      "id": "system_nor",
      "part": "W25Q512JVFIQ",
      "manufacturer": "Winbond",
      "role": "64 MiB central NOR on F133 SPI0 (BOOT-SEL 00); partition map r10_nor_map",
      "attached_to": [
        "f133"
      ],
      "provenance": "DESIGN",
      "status": "PROPOSED map; bootloader logic HOST_TESTED; D213 flashless start NOT_RUN",
      "source": "r10_memory_spec#S6"
    },
    {
      "id": "d213_boot_nor",
      "part": "W25Q512JVFIQ",